"24","PRIORITY CONTRIBUTION: Future novel threats and opportunities facing UK biodiversity identified by horizon scanning","Journal of Applied Ecology","0021-8901, 1365-2664","","","Article","1","bronze","05 Environmental Sciences; 0501 Ecological Applications; 0502 Environmental Science and Management; 06 Biological Sciences; 0602 Ecology; 31 Biological Sciences; 3103 Ecology; 3109 Zoology; 41 Environmental Sciences; 4104 Environmental Management","","Bangor University; British Ecological Society; British Trust for Ornithology; Butterfly Conservation; Centre for Environment, Fisheries and Aquaculture Science; Environment Agency; Government of the United Kingdom; Joint Nature Conservation Committee; Lancaster University; Microsoft Research (United Kingdom); National Trust; Natural England; Natural Environment Research Council; Queen's University Belfast; Royal Society for the Protection of Birds; Scottish Environment Protection Agency; Scottish Government; Scottish Natural Heritage; University of Cambridge; University of East Anglia; University of Essex; University of Oxford; University of Sheffield; University of York; Welsh Government; Zoological Society of London","Department for Environment, Food and Rural Affairs; Natural Environment Research Council","10/9/2007","10.1111/j.1365-2664.2008.01474.x","","","http://doi.wiley.com/10.1111/j.1365-2664.2008.01474.x","","","","","","","","","0","1","7","0","4","0","0","0","2","0","0","0","0","0","0","0","0","426","111","https://www.altmetric.com/details/5315378","https://api.altmetric.com/v1/donut/5315378_240.png","Wiley"
"24","Food security and global environmental change: emerging challenges","Environmental Science & Policy","1462-9011, 1873-6416","","","Article","","closed","05 Environmental Sciences; 0502 Environmental Science and Management; 41 Environmental Sciences; 4101 Climate Change Impacts and Adaptation; 44 Human Society; 4406 Human Geography; 4410 Sociology","2 Zero Hunger; 13 Climate Action","University of Oxford","Natural Environment Research Council","6/1/2009","10.1016/j.envsci.2009.04.007","","","","","","10568/35031","","","","","","0","1","7","0","0","0","0","0","0","0","0","0","0","0","0","0","0","783","224","https://www.altmetric.com/details/5923981","https://api.altmetric.com/v1/donut/5923981_240.png","Elsevier BV"
"23","Beyond Deforestation: Restoring Forests and Ecosystem Services on Degraded Lands","Science","0036-8075, 1095-9203","","","Article","","closed","05 Environmental Sciences; 0501 Ecological Applications; 0502 Environmental Science and Management; 06 Biological Sciences; 0602 Ecology; 07 Agricultural and Veterinary Sciences; 0705 Forestry Sciences; 30 Agricultural, Veterinary and Food Sciences; 3007 Forestry Sciences; 31 Biological Sciences; 3103 Ecology; 41 Environmental Sciences; 4102 Ecological Applications; 4104 Environmental Management","15 Life on Land","University of Connecticut","Directorate for Biological Sciences","6/13/2008","10.1126/science.1155365","","","http://www.sciencemag.org/cgi/doi/10.1126/science.1155365","18556551","","","2008Sci...320.1458C","","","","","0","0","7","0","2","0","0","0","5","0","0","0","0","1","0","0","0","2250","1126","https://www.altmetric.com/details/532784","https://api.altmetric.com/v1/donut/532784_240.png","American Association for the Advancement of Science (AAAS)"
"22","Overshoot, adapt and recover","Nature","0028-0836, 1476-4687","","","Article","","closed","31 Biological Sciences; 3103 Ecology","","Imperial College London","","4/29/2009","10.1038/4581102a","","","http://www.nature.com/doifinder/10.1038/4581102a","19407775","","","2009Natur.458.1102P","","","","","0","1","7","0","0","0","0","0","0","0","0","0","0","0","0","0","0","101","124","https://www.altmetric.com/details/1375114","https://api.altmetric.com/v1/donut/1375114_240.png","Scientific American; Springer Nature"
"20","Stimulating post鈥怌OVID 鈥?9 green recovery by investing in ecological restoration","Restoration Ecology","1061-2971, 1526-100X","","","Article","1","green","05 Environmental Sciences; 0502 Environmental Science and Management; 41 Environmental Sciences; 4104 Environmental Management","","Natural Resources Canada","Natural Resources Canada","11/5/2020","10.1111/rec.13296","","","","33230382","","","","","","","","0","1","7","0","12","0","0","2","0","0","0","0","0","0","0","0","0","114","13","https://www.altmetric.com/details/92940546","https://api.altmetric.com/v1/donut/92940546_240.png","Wiley"
"15","Responding to public and private politics: corporate disclosure of climate change strategies","Strategic Management Journal","0143-2095, 1097-0266","","","Article","1","green","15 Commerce, Management, Tourism and Services; 1503 Business and Management; 35 Commerce, Management, Tourism and Services; 3507 Strategy, Management and Organisational Behaviour","13 Climate Action","Harvard University","","11/1/2009","10.1002/smj.796","","","","","","","","","","","","0","0","7","0","0","0","0","0","1","0","0","0","0","0","0","0","0","788","651","https://www.altmetric.com/details/8825803","https://api.altmetric.com/v1/donut/8825803_240.png","ESSOAr; Natural History Museum; Wiley"
"6","National and global greenhouse gas dynamics of different forest management and wood use scenarios: a model-based assessment","Environmental Science & Policy","1462-9011, 1873-6416","","","Article","","closed","07 Agricultural and Veterinary Sciences; 0705 Forestry Sciences; 30 Agricultural, Veterinary and Food Sciences; 3007 Forestry Sciences; 41 Environmental Sciences; 4104 Environmental Management","13 Climate Action; 15 Life on Land","GEO Partner (Switzerland); Swiss Federal Institute for Forest, Snow and Landscape Research","Federal Office for the Environment","2/1/2010","10.1016/j.envsci.2009.10.004","","","http://linkinghub.elsevier.com/retrieve/pii/S1462901109001622","","","","","","","","","0","0","7","0","0","0","0","0","0","0","0","0","0","0","0","0","0","215","114","https://www.altmetric.com/details/16055409","https://api.altmetric.com/v1/donut/16055409_240.png","Elsevier BV"
"3","Rural household pluriactivity and plurilocality: a source of resilience to climate breakdown","IOP Conference Series:  Earth & Environment Science","1755-1307, 1755-1315","","","Article","1","gold","16 Studies in Human Society; 1604 Human Geography; 1608 Sociology; 30 Agricultural, Veterinary and Food Sciences; 37 Earth Sciences; 41 Environmental Sciences","13 Climate Action","Erasmus University Rotterdam","","3/1/2020","10.1088/1755-1315/451/1/012001","","","","","","","","","","","","0","0","7","0","0","0","0","0","0","0","0","0","0","0","0","0","0","10","1","https://www.altmetric.com/details/113776582","https://api.altmetric.com/v1/donut/113776582_240.png","IOP Publishing"
"3572","Global warming and recurrent mass bleaching of corals","Nature","0028-0836, 1476-4687","","","Article","1","green","05 Environmental Sciences; 0502 Environmental Science and Management; 06 Biological Sciences; 0602 Ecology; 31 Biological Sciences; 3103 Ecology; 41 Environmental Sciences; 4104 Environmental Management","13 Climate Action","ARC Centre of Excellence for Coral Reef Studies; Australian Institute of Marine Science; Curtin University; Global Science & Technology (United States); Great Barrier Reef Marine Park Authority; Griffith University; James Cook University; National Oceanic and Atmospheric Administration; Queensland Museum; The University of Sydney; University of Leeds; University of Queensland; University of Western Australia","Australian Research Council; European Commission; National Oceanic and Atmospheric Administration; National Science Foundation","3/16/2017","10.1038/nature21707","","","http://www.nature.com/doifinder/10.1038/nature21707","28300113","","","2017Natur.543..373H","","","","","451","58","6","0","2665","0","0","31","16","3","0","0","0","0","0","2","0","2913","2003","https://www.altmetric.com/details/17388364","https://api.altmetric.com/v1/donut/17388364_240.png","Scientific American; Springer Nature"
"2792","The Arctic is burning like never before 鈥?and that鈥檚 bad news for climate change","Nature","0028-0836, 1476-4687","","","News","","closed","30 Agricultural, Veterinary and Food Sciences; 3007 Forestry Sciences; 47 Language, Communication and Culture","13 Climate Action","","","9/10/2020","10.1038/d41586-020-02568-y","","","","32913318","","","","","","","","76","18","6","0","4322","0","0","19","4","0","0","9","0","0","0","0","0","53","69","https://www.altmetric.com/details/89822810","https://api.altmetric.com/v1/donut/89822810_240.png","Scientific American; Springer Nature"
"414","Quantifying Carbon Footprint Reduction Opportunities for U.S. Households and Communities","Environmental Science & Technology","0013-936X, 1520-5851","","","Article","","closed","14 Economics; 1402 Applied Economics; 38 Economics; 41 Environmental Sciences; 4104 Environmental Management","13 Climate Action","University of California, Berkeley","California Environmental Protection Agency; Directorate for Social, Behavioral & Economic Sciences","3/30/2011","10.1021/es102221h","","","","21449584","","","2011EnST...45.4088J","","","","","51","3","6","0","4","0","0","0","1","1","0","1","0","0","0","0","0","501","310","https://www.altmetric.com/details/1470769","https://api.altmetric.com/v1/donut/1470769_240.png","American Chemical Society (ACS)"
"392","World Seas: An Environmental Evaluation","","","","","Book","","closed","","","","","10/1/2018","10.1016/c2015-0-04336-2","9780128050521","","https://www.elsevier.com/books/world-seas-an-environmental-evaluation/unknown/978-0-12-805052-1","","","","","","","","","60","7","6","0","137","0","0","1","12","0","0","0","0","0","0","1","0","60","2","https://www.altmetric.com/details/34871410","https://api.altmetric.com/v1/donut/34871410_240.png","Elsevier BV"
"286","Winning coalitions for climate policy","Science","0036-8075, 1095-9203","","","Article","","closed","16 Studies in Human Society; 1605 Policy and Administration; 44 Human Society; 4407 Policy and Administration; 4408 Political Science","13 Climate Action","University of California, Berkeley; University of California System","National Institute of Food and Agriculture","9/11/2015","10.1126/science.aab1336","","","","26359392","","","2015Sci...349.1170M","","","","","17","15","6","0","172","0","0","1","4","0","0","0","0","0","0","0","0","232","187","https://www.altmetric.com/details/4494985","https://api.altmetric.com/v1/donut/4494985_240.png","American Association for the Advancement of Science (AAAS)"
"138","Health benefits of policies to reduce carbon emissions","British Medical Journal","0267-0623, 0959-8138, 1756-1833, 1468-5833, 1759-2151, 0007-1447, 0959-535X","","","Article","1","hybrid","11 Medical and Health Sciences; 1103 Clinical Sciences; 1117 Public Health and Health Services; 42 Health Sciences; 4206 Public Health","13 Climate Action","King's College London; London School of Hygiene & Tropical Medicine; MRC Epidemiology Unit; University College London","Engineering and Physical Sciences Research Council; Medical Research Council; Wellcome Trust","3/30/2020","10.1136/bmj.l6758","","","","32229476","","","","","","","","7","3","6","0","95","0","0","0","0","0","0","0","0","0","0","0","0","100","36","https://www.altmetric.com/details/78680805","https://api.altmetric.com/v1/donut/78680805_240.png","BMJ Group; StatRef"
"117","Global metaanalysis of the nonlinear response of soil nitrous oxide (N 2 O) emissions to fertilizer nitrogen","Proceedings of the National Academy of Sciences of the United States of America","0027-8424, 1091-6490","","","Article","1","bronze","05 Environmental Sciences; 0503 Soil Sciences; 30 Agricultural, Veterinary and Food Sciences; 3002 Agriculture, Land and Farm Management; 3004 Crop and Pasture Production; 41 Environmental Sciences","13 Climate Action","Michigan State University","Directorate for Biological Sciences; Electric Power Research Institute; National Institute of Food and Agriculture; Office of Energy Efficiency and Renewable Energy; Office of Science","6/9/2014","10.1073/pnas.1322434111","","","","24927583","","","2014PNAS..111.9199S","","","","","11","2","6","0","18","0","0","2","0","0","0","0","0","0","0","0","0","798","742","https://www.altmetric.com/details/2422010","https://api.altmetric.com/v1/donut/2422010_240.png","Proceedings of the National Academy of Sciences (PNAS)"
"109","Ecosystem Carbon Stock Influenced by Plantation Practice: Implications for Planting Forests as a Measure of Climate Change Mitigation","PLOS ONE","1932-6203","","","Article","1","gold","05 Environmental Sciences; 0502 Environmental Science and Management; 0503 Soil Sciences; 06 Biological Sciences; 0699 Other Biological Sciences; 07 Agricultural and Veterinary Sciences; 0705 Forestry Sciences; 30 Agricultural, Veterinary and Food Sciences; 3007 Forestry Sciences; 31 Biological Sciences; 3103 Ecology; 41 Environmental Sciences; 4102 Ecological Applications","13 Climate Action","Fudan University; University of Oklahoma","Directorate for Biological Sciences; Ministry of Science and Technology of the People's Republic of China","5/27/2010","10.1371/journal.pone.0010867","","","","20523733","PMC2877715","","2010PLoSO...510867L","","","","","10","2","6","0","9","0","0","0","0","0","0","0","0","0","0","0","0","264","117","https://www.altmetric.com/details/417778","https://api.altmetric.com/v1/donut/417778_240.png","Public Library of Science (PLOS)"
"80","Implications of global climate change for the assessment and management of human health risks of chemicals in the natural environment","Environmental Toxicology & Chemistry","0730-7268, 1552-8618","","","Article","1","hybrid","03 Chemical Sciences; 0399 Other Chemical Sciences; 05 Environmental Sciences; 0502 Environmental Science and Management; 41 Environmental Sciences; 4105 Pollution and Contamination","3 Good Health and Well Being","California Environmental Protection Agency; Lawrence Berkeley National Laboratory; National Institute of Environmental Health Sciences; University of Washington; University of York","American Chemistry Council; California Environmental Protection Agency; DuPont (United States); Environmental Protection Agency, Washington D.C., United States; National Institute of Environmental Health Sciences; National Oceanic and Atmospheric Administration; The Research Council of Norway; Unilever (United Kingdom); United States Department of Energy; United States Fish and Wildlife Service; United States Geological Survey","12/18/2012","10.1002/etc.2046","","","","23147420","","","","","","","","7","1","6","0","4","0","0","0","0","1","0","0","0","0","0","0","0","252","108","https://www.altmetric.com/details/1073965","https://api.altmetric.com/v1/donut/1073965_240.png","ESSOAr; Natural History Museum; Wiley"
"72","Transforming management of tropical coastal seas to cope with challenges of the 21st century","Marine Pollution Bulletin","0025-326X, 1879-3363","","","Article","1","hybrid","05 Environmental Sciences; 0502 Environmental Science and Management; 06 Biological Sciences; 0602 Ecology; 41 Environmental Sciences; 4104 Environmental Management; 48 Law and Legal Studies; 4803 International and Comparative Law","14 Life Below Water","Australian National University; Coastal Oceans Research and Development in the Indian Ocean; Florida Institute of Technology; James Cook University; Newcastle University; Northwest Fisheries Science Center; Secretariat of the Pacific Community; Stockholm University; University of Connecticut; University of East Anglia; University of Florida; University of Hong Kong; University of Queensland; University of South Florida; University of Technology Sydney; University of Warwick; University of Washington","National Institute of Food and Agriculture; United Nations","8/1/2014","10.1016/j.marpolbul.2014.06.005","","","http://linkinghub.elsevier.com/retrieve/pii/S0025326X1400366X","24997002","","","","","","","","5","2","6","0","20","0","0","0","0","0","0","0","0","0","0","0","0","469","111","https://www.altmetric.com/details/2480513","https://api.altmetric.com/v1/donut/2480513_240.png","Elsevier BV"
"53","Shifting paradigms in restoration of the world's coral reefs","Global Change Biology","1354-1013, 1365-2486","","","Article","1","green","05 Environmental Sciences; 0501 Ecological Applications; 0502 Environmental Science and Management; 06 Biological Sciences; 0602 Ecology; 0699 Other Biological Sciences; 31 Biological Sciences; 3103 Ecology; 41 Environmental Sciences; 4102 Ecological Applications; 4104 Environmental Management","13 Climate Action; 14 Life Below Water","Agricultural Research Service - Pacific West Area; ARC Centre of Excellence for Coral Reef Studies; Australian Institute of Marine Science; Great Barrier Reef Marine Park Authority; James Cook University; Macquarie University; National Oceanic and Atmospheric Administration; Southern Cross University; SUNY College of Environmental Science and Forestry; The University of Sydney; University of Hawaii at Manoa; University of Melbourne","Australian Institute of Marine Science; Directorate for Geosciences","3/1/2017","10.1111/gcb.13647","","","","28247459","","","2017GCBio..23.3437V","","","","","1","1","6","0","50","0","0","4","0","0","0","0","0","0","0","0","0","753","291","https://www.altmetric.com/details/16869974","https://api.altmetric.com/v1/donut/16869974_240.png","Wiley"
"47","Humanity鈥檚 unsustainable environmental footprint","Science","0036-8075, 1095-9203","","","Article","","closed","05 Environmental Sciences; 0502 Environmental Science and Management; 14 Economics; 1402 Applied Economics; 38 Economics; 41 Environmental Sciences; 4104 Environmental Management","12 Responsible Consumption and Production","University of Twente; UNSW Sydney","","6/6/2014","10.1126/science.1248365","","","http://www.sciencemag.org/cgi/doi/10.1126/science.1248365","24904155","","","2014Sci...344.1114H","","","","","1","0","6","0","38","0","0","1","0","1","0","0","0","0","0","0","0","1039","703","https://www.altmetric.com/details/2407619","https://api.altmetric.com/v1/donut/2407619_240.png","American Association for the Advancement of Science (AAAS)"
"37","Mitigating and adapting to climate change: Multi-functional and multi-scale assessment of green urban infrastructure","Journal of Environmental Management","0301-4797, 1095-8630","","","Article","","closed","16 Studies in Human Society; 1604 Human Geography; 33 Built Environment and Design; 41 Environmental Sciences; 4101 Climate Change Impacts and Adaptation","11 Sustainable Cities and Communities; 13 Climate Action","Estonian University of Life Sciences; Finnish Environment Institute; Indian Institute of Technology Kharagpur; KU Leuven; Newcastle University; Tecnalia; Ume氓 University; University of Helsinki; University of Tartu; University of Trento","Department for Environment, Food and Rural Affairs; European Cooperation in Science and Technology; European Science Foundation; Fund for Scientific Research; Research Foundation - Flanders","12/1/2014","10.1016/j.jenvman.2014.07.025","","","","25163601","","","","","","","","2","0","6","0","7","0","0","0","0","0","0","0","0","0","0","0","0","1602","557","https://www.altmetric.com/details/2645859","https://api.altmetric.com/v1/donut/2645859_240.png","Elsevier BV"
"34","Integrating health and environmental impact analysis","Public Health (Elsevier)","0033-3506, 1476-5616","","","Article","1","hybrid","11 Medical and Health Sciences; 1117 Public Health and Health Services; 42 Health Sciences; 4202 Epidemiology; 4203 Health Services and Systems; 4206 Public Health","13 Climate Action","Institute of Occupational Medicine, Edinburgh, United Kingdom; Plymouth Marine Laboratory; Public Health Scotland; UK Centre for Ecology & Hydrology; University of Exeter","European Commission","10/1/2015","10.1016/j.puhe.2013.07.006","","","http://linkinghub.elsevier.com/retrieve/pii/S0033350613002424","24099716","","10871/17383","","","","","","0","0","6","0","39","0","0","0","0","0","0","0","0","0","0","0","0","303","79","https://www.altmetric.com/details/1806880","https://api.altmetric.com/v1/donut/1806880_240.png","Elsevier BV"
"29","Adaptive governance, ecosystem management, and natural capital","Proceedings of the National Academy of Sciences of the United States of America","0027-8424, 1091-6490","","","Article","1","bronze","05 Environmental Sciences; 0502 Environmental Science and Management; 06 Biological Sciences; 0602 Ecology; 41 Environmental Sciences; 4101 Climate Change Impacts and Adaptation; 4104 Environmental Management; 48 Law and Legal Studies; 4803 International and Comparative Law","","Royal Swedish Academy of Sciences; Stellenbosch University; Stockholm University","","6/15/2015","10.1073/pnas.1406493112","","","http://urn.kb.se/resolve?urn=urn:nbn:se:su:diva-118955","26082542","","","2015PNAS..112.7369S","","","","","0","0","6","0","35","0","0","0","0","0","0","0","0","0","0","0","0","707","205","https://www.altmetric.com/details/4170069","https://api.altmetric.com/v1/donut/4170069_240.png","Proceedings of the National Academy of Sciences (PNAS)"
"24","Prioritizing Key Resilience Indicators to Support Coral Reef Management in a Changing Climate","PLOS ONE","1932-6203","","","Article","1","gold","05 Environmental Sciences; 0502 Environmental Science and Management; 06 Biological Sciences; 0602 Ecology; 31 Biological Sciences; 3103 Ecology; 41 Environmental Sciences; 4102 Ecological Applications; 4104 Environmental Management","13 Climate Action; 14 Life Below Water","ARC Centre of Excellence for Coral Reef Studies; Australian Institute of Marine Science; Centre de Recherches Insulaires et Observatoire de l'Environnement; Conservation International; Florida Institute of Technology; James Cook University; Macquarie University; National Institute of Water and Atmospheric Research; National Oceanic and Atmospheric Administration; Santa Barbara City College; Simon Fraser University; The Nature Conservancy, Arlington, United States; University of British Columbia; University of Miami; University of Queensland; Wildlife Conservation Society; Wildlife Conservation Society Fiji; Wildlife Conservation Society Indonesia","John D. and Catherine T. MacArthur Foundation; National Oceanic and Atmospheric Administration; Natural Environment Research Council","8/29/2012","10.1371/journal.pone.0042884","","","http://dx.plos.org/10.1371/journal.pone.0042884","22952618","","","2012PLoSO...742884M","","","","","0","2","6","0","4","0","0","2","0","0","0","0","0","0","0","1","0","654","185","https://www.altmetric.com/details/923931","https://api.altmetric.com/v1/donut/923931_240.png","Public Library of Science (PLOS)"
"24","Tourism and Environment","Annual Review of Environment & Resources","1543-5938, 1545-2050","","","Article","1","bronze","05 Environmental Sciences; 0502 Environmental Science and Management; 06 Biological Sciences; 0602 Ecology; 35 Commerce, Management, Tourism and Services; 3504 Commercial Services; 3506 Marketing; 3508 Tourism; 41 Environmental Sciences","13 Climate Action","Griffith University","","11/21/2011","10.1146/annurev-environ-041210-132637","","","","","","","","","","","","1","1","6","0","1","0","0","0","3","0","0","0","0","0","0","0","0","418","142","https://www.altmetric.com/details/828756","https://api.altmetric.com/v1/donut/828756_240.png","Annual Reviews"
"23","Can Reducing Black Carbon Emissions Counteract Global Warming?","Environmental Science & Technology","0013-936X, 1520-5851","","","Article","1","bronze","06 Biological Sciences; 0699 Other Biological Sciences; 37 Earth Sciences; 3701 Atmospheric Sciences","13 Climate Action","University of Illinois Urbana-Champaign","","7/6/2005","10.1021/es0480421","","","","16173547","","","2005EnST...39.5921B","","","","","0","1","6","0","0","0","0","0","1","0","0","0","0","0","0","0","0","340","253","https://www.altmetric.com/details/1692984","https://api.altmetric.com/v1/donut/1692984_240.png","American Chemical Society (ACS)"
"11","Deriving Multiple Benefits from Carbon Market-Based Savanna Fire Management: An Australian Example","PLOS ONE","1932-6203","","","Article","1","gold","05 Environmental Sciences; 0502 Environmental Science and Management; 07 Agricultural and Veterinary Sciences; 0705 Forestry Sciences; 41 Environmental Sciences; 4102 Ecological Applications; 4104 Environmental Management","13 Climate Action","Australian National University; Charles Darwin University","","12/2/2015","10.1371/journal.pone.0143426","","","","26630453","PMC4668068","","2015PLoSO..1043426R","","","","","0","0","6","0","17","0","0","0","0","0","0","0","0","0","0","0","0","136","67","https://www.altmetric.com/details/4835211","https://api.altmetric.com/v1/donut/4835211_240.png","Public Library of Science (PLOS)"
"9","Global climate change: implications for international public health policy","Bulletin of the World Health Organization","0042-9686","","","Article","1","bronze","11 Medical and Health Sciences; 32 Biomedical and Clinical Sciences; 42 Health Sciences","","World Health Organization","","3/1/2007","10.2471/blt.06.039503","","","","17486218","","","","","","","","0","0","6","0","0","0","0","0","0","0","0","0","0","0","0","0","0","166","67","https://www.altmetric.com/details/14565326","https://api.altmetric.com/v1/donut/14565326_240.png",""
