"12","An update on the Clean Development Mechanism in Africa in times of market crisis","Climate and Development","1756-5529, 1756-5537","","","Article","1","green","16 Studies in Human Society; 1605 Policy and Administration; 44 Human Society; 4404 Development Studies","","NewClimate Institute; Wuppertal Institute for Climate, Environment and Energy","Federal Ministry for the Environment, Nature Conservation, Nuclear Safety and Consumer Protection","4/15/2016","10.1080/17565529.2016.1145102","","","","","","","","","","","","0","0","4","0","5","0","0","0","0","0","0","0","0","0","0","0","0","52","10","https://www.altmetric.com/details/6828803","https://api.altmetric.com/v1/donut/6828803_240.png","Taylor & Francis"
"12","Life cycle assessment","","0160-4120, 1873-6750","","","Article","","closed","05 Environmental Sciences; 0502 Environmental Science and Management; 38 Economics; 41 Environmental Sciences; 4104 Environmental Management","12 Responsible Consumption and Production","2.-0 LCA Consultants (Denmark); Chalmers University of Technology; 脡cole Polytechnique F茅d茅rale de Lausanne; ESU-Services (Switzerland); Ford (Germany); Joint Research Centre, Ispra, Italy; Leiden University; University of New Hampshire","","7/1/2004","10.1016/j.envint.2003.11.005","","","","15051246","","","","","","","","0","1","4","0","0","0","0","0","0","0","0","0","0","0","0","0","0","2318","1292","https://www.altmetric.com/details/4324999","https://api.altmetric.com/v1/donut/4324999_240.png","Elsevier BV"
"11","Regional-Scale Assembly Rules and Biodiversity of Coral Reefs","Science","0036-8075, 1095-9203","","","Article","","closed","05 Environmental Sciences; 0501 Ecological Applications; 0502 Environmental Science and Management; 06 Biological Sciences; 0602 Ecology; 31 Biological Sciences; 3103 Ecology; 41 Environmental Sciences; 4102 Ecological Applications; 4104 Environmental Management","","James Cook University","","5/25/2001","10.1126/science.1058635","","","","11375488","","","2001Sci...292.1532B","","","","","0","0","4","0","1","0","0","0","0","0","0","0","0","1","0","0","0","1134","435","https://www.altmetric.com/details/101757506","https://api.altmetric.com/v1/donut/101757506_240.png","American Association for the Advancement of Science (AAAS)"
"10","Measuring and monitoring soil organic carbon stocks in agricultural lands for climate mitigation","Frontiers in Ecology & the Environment","1540-9295, 1540-9309","","","Article","1","green","05 Environmental Sciences; 0503 Soil Sciences; 41 Environmental Sciences; 4101 Climate Change Impacts and Adaptation; 4106 Soil Sciences","13 Climate Action","Colorado State University","National Aeronautics and Space Administration; National Institute of Food and Agriculture; Office of Biological and Environmental Research; Robertson Foundation","6/8/2010","10.1890/090153","","","","","","","","","","","","0","0","4","0","1","0","0","0","0","0","0","0","0","0","0","0","0","217","124","https://www.altmetric.com/details/101793815","https://api.altmetric.com/v1/donut/101793815_240.png","Wiley"
"9","An operational method for the evaluation of resource use and environmental impacts of dairy farms by life cycle assessment","Journal of Environmental Management","0301-4797, 1095-8630","","","Article","","closed","05 Environmental Sciences; 0502 Environmental Science and Management; 30 Agricultural, Veterinary and Food Sciences; 38 Economics; 41 Environmental Sciences; 4104 Environmental Management","7 Affordable and Clean Energy; 13 Climate Action","Centre Bretagne-Normandie; Soil Agro and Hydrosystems Spatialization","","8/1/2009","10.1016/j.jenvman.2009.07.003","","","http://linkinghub.elsevier.com/retrieve/pii/S0301479709002424","19664872","","","","","","","","0","0","4","0","0","0","0","0","0","0","0","0","0","0","0","0","0","243","129","https://www.altmetric.com/details/16063075","https://api.altmetric.com/v1/donut/16063075_240.png","Elsevier BV"
"7","Life Cycle Assessment of Chinese Shrimp Farming Systems Targeted for Export and Domestic Sales","Environmental Science & Technology","0013-936X, 1520-5851","","","Article","","closed","05 Environmental Sciences; 0502 Environmental Science and Management; 30 Agricultural, Veterinary and Food Sciences; 41 Environmental Sciences; 4104 Environmental Management","12 Responsible Consumption and Production","Hainan University; University of Michigan鈥揂nn Arbor","Directorate for Engineering; United States Agency for International Development","6/30/2011","10.1021/es104058z","","","","21714571","","","2011EnST...45.6531C","","","","","0","0","4","0","2","0","0","0","0","0","0","0","0","0","0","0","0","253","96","https://www.altmetric.com/details/102452259","https://api.altmetric.com/v1/donut/102452259_240.png","American Chemical Society (ACS)"
"7","Adaptive Flood Risk Management Under Climate Change Uncertainty Using Real Options and Optimization","Risk Analysis: An International Journal","0272-4332, 1539-6924, 1573-9147","","","Article","1","green","14 Economics; 1402 Applied Economics; 37 Earth Sciences; 3701 Atmospheric Sciences","","HR Wallingford; University of Exeter","Department for Environment, Food and Rural Affairs; Engineering and Physical Sciences Research Council; Innovate UK","7/8/2013","10.1111/risa.12088","","","http://doi.wiley.com/10.1111/risa.12088","23834841","","10871/18778","","","","","","0","0","4","0","1","0","0","0","0","0","0","0","0","0","0","0","0","287","125","https://www.altmetric.com/details/5315440","https://api.altmetric.com/v1/donut/5315440_240.png","Wiley"
"6","Tipping bucket mechanical errors and their influence on rainfall statistics and extremes","Water Science & Technology","0273-1223, 1996-9732","","","Article","","closed","01 Mathematical Sciences; 0104 Statistics; 37 Earth Sciences; 3701 Atmospheric Sciences","","","","1/1/2002","10.2166/wst.2002.0020","","","","","","","","","","","","0","0","4","0","0","0","0","0","0","0","0","0","0","0","0","0","0","34","55","https://www.altmetric.com/details/76953191","https://api.altmetric.com/v1/donut/76953191_240.png","IWA Publishing"
"6","Environmental assessment of bio鈥恇ased chemicals in early鈥恠tage development: a review of methods and indicators","Biofuels, Bioproducts and Biorefining","1932-104X, 1932-1031","","","Article","1","hybrid","09 Engineering; 10 Technology; 40 Engineering","","National Institute for Public Health and the Environment; Radboud University Nijmegen; Utrecht University","National Institute for Public Health and the Environment","5/9/2017","10.1002/bbb.1772","","","","","","","","","","","","0","0","4","0","0","0","0","0","0","0","0","0","0","0","0","0","0","101","30","https://www.altmetric.com/details/67247823","https://api.altmetric.com/v1/donut/67247823_240.png","ESSOAr; Natural History Museum; Wiley"
"5","Index insurance and climate risk management: Addressing social equity","Development Policy Review","0950-6764, 1467-7679","","","Article","1","hybrid","16 Studies in Human Society; 1608 Sociology; 44 Human Society; 4404 Development Studies","10 Reduced Inequalities","Columbia University; International Livestock Research Institute; International Maize and Wheat Improvement Center, Texcoco, Mexico; International Rice Research Institute; University of Reading","European Commission; United States Agency for International Development","5/27/2019","10.1111/dpr.12387","","","","","","10883/19656","","","","","","0","0","4","0","6","0","0","0","0","0","0","0","0","0","0","0","0","144","30","https://www.altmetric.com/details/43310252","https://api.altmetric.com/v1/donut/43310252_240.png","Wiley"
"5","Wellbeing Impacts of City Policies for Reducing Greenhouse Gas Emissions","International Journal of Environmental Research and Public Health","1661-7827, 1660-4601","","","Article","1","gold","16 Studies in Human Society; 1604 Human Geography; 33 Built Environment and Design; 3304 Urban and Regional Planning; 44 Human Society; 4406 Human Geography","13 Climate Action","Swiss Tropical and Public Health Institute; University of Bristol","European Commission; World Health Organization","11/28/2014","10.3390/ijerph111212312","","","","25464129","","","","","","","","0","0","4","0","4","0","0","0","0","0","0","0","0","0","0","0","0","128","14","https://www.altmetric.com/details/2938151","https://api.altmetric.com/v1/donut/2938151_240.png","MDPI"
"3","An examination of ecological risk assessment and management practices","Environment International","0160-4120, 1873-6750","","","Article","","closed","05 Environmental Sciences; 0502 Environmental Science and Management; 06 Biological Sciences; 0602 Ecology; 11 Medical and Health Sciences; 1117 Public Health and Health Services; 41 Environmental Sciences; 4102 Ecological Applications; 4104 Environmental Management","","Oregon Department of Environmental Quality","","12/1/2006","10.1016/j.envint.2006.06.005","","","http://linkinghub.elsevier.com/retrieve/pii/S016041200600081X","16843527","","","","","","","","0","0","4","0","0","0","0","0","0","0","0","0","0","0","0","0","0","233","144","https://www.altmetric.com/details/16142170","https://api.altmetric.com/v1/donut/16142170_240.png","Elsevier BV"
"355","Environmental co-benefits and adverse side-effects of alternative power sector decarbonization strategies","Nature Communications","2041-1723","","","Article","1","gold","05 Environmental Sciences; 0502 Environmental Science and Management; 38 Economics; 41 Environmental Sciences; 4104 Environmental Management","7 Affordable and Clean Energy; 13 Climate Action","Centre Bretagne-Normandie; International Institute for Applied Systems Analysis; Joint Global Change Research Institute; Luxembourg Institute of Science and Technology; Norwegian University of Science and Technology; Potsdam Institute for Climate Impact Research; Technical University of Berlin; Utrecht University; Yale University","European Commission; The Research Council of Norway; United States Department of Energy","11/19/2019","10.1038/s41467-019-13067-8","","","","31745077","","","","","","","","30","7","3","0","256","0","0","0","3","0","0","0","0","0","0","1","0","425","150","https://www.altmetric.com/details/70760108","https://api.altmetric.com/v1/donut/70760108_240.png","Scientific American; Springer Nature"
"348","Climate science is supporting lawsuits that could help save the world","Nature","0028-0836, 1476-4687","","","News","","closed","48 Law and Legal Studies; 4802 Environmental and Resources Law","13 Climate Action","","","9/8/2021","10.1038/d41586-021-02424-7","","","","34497398","","","","","","","","13","5","3","0","451","0","0","3","2","0","0","6","0","0","0","0","0","22","9","https://www.altmetric.com/details/113073578","https://api.altmetric.com/v1/donut/113073578_240.png","Scientific American; Springer Nature"
"288","Science and the stock market: Investors' recognition of unburnable carbon","Energy Economics","0140-9883","","","Article","1","green","09 Engineering; 0906 Electrical and Electronic Engineering; 0913 Mechanical Engineering; 14 Economics; 1402 Applied Economics; 35 Commerce, Management, Tourism and Services; 3502 Banking, Finance and Investment","","University of California, Davis; University of Otago","","12/1/2015","10.1016/j.eneco.2015.08.028","","","","","","","","","","","","35","4","3","0","25","0","0","0","0","0","0","1","0","0","0","0","0","179","73","https://www.altmetric.com/details/4562511","https://api.altmetric.com/v1/donut/4562511_240.png","Elsevier BV"
"246","Fix the broken food system in three steps","Nature","0028-0836, 1476-4687","","","News","1","bronze","30 Agricultural, Veterinary and Food Sciences; 32 Biomedical and Clinical Sciences; 3210 Nutrition and Dietetics","2 Zero Hunger","","","5/8/2019","10.1038/d41586-019-01420-2","","","","31068714","","","","","","","","0","2","3","0","385","0","0","10","0","0","0","2","0","0","0","0","0","157","55","https://www.altmetric.com/details/60063433","https://api.altmetric.com/v1/donut/60063433_240.png","Scientific American; Springer Nature"
"236","Natural climate solutions are not enough","Science","0036-8075, 1095-9203","","","Article","","closed","05 Environmental Sciences; 0501 Ecological Applications; 38 Economics; 41 Environmental Sciences; 4104 Environmental Management","7 Affordable and Clean Energy; 13 Climate Action","Cary Institute of Ecosystem Studies; Columbia University; Princeton University; Stanford University; University of Aberdeen; World Wide Fund for Nature, Washington D.C., United States","Natural Environment Research Council","3/1/2019","10.1126/science.aaw2741","","","","30819953","","","","","","","","11","2","3","0","220","0","0","2","0","0","0","0","0","0","0","0","0","324","92","https://www.altmetric.com/details/56196377","https://api.altmetric.com/v1/donut/56196377_240.png","American Association for the Advancement of Science (AAAS)"
"226","How to pay for saving biodiversity","Science","0036-8075, 1095-9203","","","Article","","closed","","","Colorado State University","","5/4/2018","10.1126/science.aar3454","","","","29724939","","","2018Sci...360..486B","","","","","6","1","3","0","246","0","0","6","0","2","0","0","0","0","0","0","0","261","68","https://www.altmetric.com/details/40677571","https://api.altmetric.com/v1/donut/40677571_240.png","American Association for the Advancement of Science (AAAS)"
"119","Integrating climate action for health into covid-19 recovery plans","British Medical Journal","0267-0623, 0959-8138, 1756-1833, 1468-5833, 1759-2151, 0007-1447, 0959-535X","","","Article","1","bronze","11 Medical and Health Sciences; 1103 Clinical Sciences; 1117 Public Health and Health Services; 42 Health Sciences; 4203 Health Services and Systems","13 Climate Action","London School of Hygiene & Tropical Medicine","","9/2/2020","10.1136/bmj.m3169","","","","32878746","","","","","","","","3","2","3","0","146","0","0","2","0","0","0","0","0","0","0","0","0","102","25","https://www.altmetric.com/details/89317451","https://api.altmetric.com/v1/donut/89317451_240.png","BMJ Group; StatRef"
"90","The social cost of carbon in U.S. regulatory impact analyses: an introduction and critique","Journal of Environmental Studies and Sciences","2190-6483, 2190-6491","","","Article","","closed","05 Environmental Sciences; 0502 Environmental Science and Management; 41 Environmental Sciences; 4104 Environmental Management","13 Climate Action","Natural Resources Defense Council; University of Cambridge","","9/12/2012","10.1007/s13412-012-0087-7","","","","","","","","","","","","4","8","3","0","11","0","0","1","0","4","0","0","0","0","0","0","0","120","78","https://www.altmetric.com/details/946021","https://api.altmetric.com/v1/donut/946021_240.png","Springer Nature"
"87","The Socio-Technical Dynamics of Low-Carbon Transitions","Joule","2542-4351","","","Article","1","bronze","16 Studies in Human Society; 1608 Sociology; 34 Chemical Sciences; 40 Engineering","7 Affordable and Clean Energy","Aarhus University; University of Manchester; University of Oxford; University of Sussex","Economic and Social Research Council; Engineering and Physical Sciences Research Council","11/1/2017","10.1016/j.joule.2017.09.018","","","","","","","","","","","","8","2","3","0","10","0","0","0","0","0","0","0","0","0","0","0","0","979","301","https://www.altmetric.com/details/27562744","https://api.altmetric.com/v1/donut/27562744_240.png","Elsevier BV"
"72","Infrastructure expansion challenges sustainable development in Papua New Guinea","PLOS ONE","1932-6203","","","Article","1","gold","05 Environmental Sciences; 0502 Environmental Science and Management; 06 Biological Sciences; 0602 Ecology; 41 Environmental Sciences; 4101 Climate Change Impacts and Adaptation","15 Life on Land","Eberswalde University for Sustainable Development; James Cook University; University of Papua New Guinea; Wildlife Conservation Society Papua New Guinea","","7/24/2019","10.1371/journal.pone.0219408","","","","31339902","","","","","","","","7","3","3","0","15","0","0","0","2","0","0","0","0","0","0","0","0","104","22","https://www.altmetric.com/details/63985966","https://api.altmetric.com/v1/donut/63985966_240.png","Public Library of Science (PLOS)"
"66","Managing consequences of climate鈥恉riven species redistribution requires integration of ecology, conservation and social science","Biological Reviews","1464-7931, 0006-3231, 1469-185X","","","Article","1","bronze","06 Biological Sciences; 0602 Ecology; 31 Biological Sciences; 3103 Ecology","13 Climate Action","ARC Centre of Excellence for Coral Reef Studies; ARC Centre of Excellence for Environmental Decisions; Biodiversity Research Center, Academia Sinica; Centre for Marine Socioecology; Conservation International; Cornell University; CSIRO Land and Water; CSIRO Oceans and Atmosphere; Denver Museum of Nature and Science; Griffith University; Imperial College London; James Cook University; National Cheng Kung University; National Great Rivers Research and Education Center; National Marine Fisheries Service; Stellenbosch University; The Nature Conservancy, Arlington, United States; Ume氓 University; Universidade Federal de Goi谩s; University of California, Irvine; University of Cape Town; University of Colorado Boulder; University of Connecticut; University of Copenhagen; University of Eastern Finland; University of Florida; University of Hong Kong; University of Picardie Jules Verne; University of Queensland; University of Tasmania; University of Technology Sydney; University of Western Australia; University of Wollongong; UNSW Sydney; Washington University in St. Louis; Yale University; Zoological Society of London","Academy of Finland; ARC Centre of Excellence for Environmental Decisions; Australian Research Council; Commonwealth Scientific and Industrial Research Organisation; Directorate for Geosciences; Ian Potter Foundation; National Climate Change Adaptation Research Facility; National Oceanic and Atmospheric Administration; National Research Foundation, Pretoria, South Africa; NordForsk; University Grants Committee","6/1/2017","10.1111/brv.12344","","","","28568902","","","","","","","","0","1","3","0","108","0","0","2","1","0","0","0","0","0","0","0","0","539","129","https://www.altmetric.com/details/20787343","https://api.altmetric.com/v1/donut/20787343_240.png","Wiley"
"65","Coping with the curse of freshwater variability","Science","0036-8075, 1095-9203","","","Article","","closed","04 Earth Sciences; 0406 Physical Geography and Environmental Geoscience; 37 Earth Sciences; 3707 Hydrology","13 Climate Action","Environment Agency; McMaster University; University of Massachusetts Amherst; University of Oxford; World Bank","Engineering and Physical Sciences Research Council; Natural Environment Research Council","10/24/2014","10.1126/science.1257890","","","","25342791","","","2014Sci...346..429H","","","","","3","2","3","2","29","0","0","0","1","0","0","0","0","0","0","0","0","114","140","https://www.altmetric.com/details/2807182","https://api.altmetric.com/v1/donut/2807182_240.png","American Association for the Advancement of Science (AAAS)"
"56","Adaptive management of the Great Barrier Reef: A globally significant demonstration of the benefits of networks of marine reserves","Proceedings of the National Academy of Sciences of the United States of America","0027-8424, 1091-6490","","","Article","1","bronze","05 Environmental Sciences; 0501 Ecological Applications; 0502 Environmental Science and Management; 06 Biological Sciences; 0602 Ecology; 31 Biological Sciences; 3103 Ecology; 41 Environmental Sciences; 4101 Climate Change Impacts and Adaptation; 4102 Ecological Applications; 4104 Environmental Management","14 Life Below Water; 15 Life on Land","ARC Centre of Excellence for Coral Reef Studies; Australian Institute of Marine Science; CSIRO Oceans and Atmosphere; Great Barrier Reef Marine Park Authority; James Cook University","Australian Research Council; Commonwealth Scientific and Industrial Research Organisation; Fisheries Research and Development Corporation; Great Barrier Reef Marine Park Authority","2/22/2010","10.1073/pnas.0909335107","","","http://www.pnas.org/cgi/doi/10.1073/pnas.0909335107","20176947","PMC2972947","","2010PNAS..10718278M","","","","","7","3","3","0","5","0","0","0","0","0","0","0","0","0","0","0","0","1108","376","https://www.altmetric.com/details/1079655","https://api.altmetric.com/v1/donut/1079655_240.png","Proceedings of the National Academy of Sciences (PNAS)"
"51","Adaptation Planning Support Toolbox: Measurable performance information based tools for co-creation of resilient, ecosystem-based urban plans with urban designers, decision-makers and stakeholders","Environmental Science & Policy","1462-9011, 1873-6416","","","Article","1","hybrid","05 Environmental Sciences; 07 Agricultural and Veterinary Sciences; 16 Studies in Human Society; 41 Environmental Sciences; 4101 Climate Change Impacts and Adaptation","11 Sustainable Cities and Communities; 13 Climate Action","Delft University of Technology; Deltares; Wageningen University & Research","Deltares; European Commission; Ministry of Infrastructure and the Environment","12/1/2016","10.1016/j.envsci.2016.06.010","","","","","","","","","","","","6","0","3","0","2","0","0","0","0","0","0","0","0","0","0","0","0","376","59","https://www.altmetric.com/details/9847509","https://api.altmetric.com/v1/donut/9847509_240.png","Elsevier BV"
"48","Solar radiation management: a proposal for immediate polycentric governance","Climate Policy","1469-3062, 1752-7457","","","Article","1","hybrid","16 Studies in Human Society; 1605 Policy and Administration; 44 Human Society; 4407 Policy and Administration","16 Peace, Justice and Strong Institutions","American University; University of California, Santa Cruz; University of Waikato","","12/4/2017","10.1080/14693062.2017.1400944","","","","","","","","","","","","1","1","3","0","42","0","0","1","0","1","0","0","0","0","0","0","0","100","55","https://www.altmetric.com/details/29985237","https://api.altmetric.com/v1/donut/29985237_240.png","Taylor & Francis"
"44","Operationalizing resilience for adaptive coral reef management under global environmental change","Global Change Biology","1354-1013, 1365-2486","","","Article","1","hybrid","05 Environmental Sciences; 0501 Ecological Applications; 0502 Environmental Science and Management; 06 Biological Sciences; 0602 Ecology; 31 Biological Sciences; 3103 Ecology; 41 Environmental Sciences; 4101 Climate Change Impacts and Adaptation; 4102 Ecological Applications; 4104 Environmental Management","11 Sustainable Cities and Communities; 13 Climate Action; 14 Life Below Water","ARC Centre of Excellence for Coral Reef Studies; Atlantic Oceanographic and Meteorological Laboratory; Australian Institute of Marine Science; Centre de Recherches Insulaires et Observatoire de l'Environnement; Coastal Oceans Research and Development in the Indian Ocean; Great Barrier Reef Marine Park Authority; International Union for Conservation of Nature, Gland, Switzerland; James Cook University; National Oceanic and Atmospheric Administration; Nova Southeastern University; Stockholm University; The Nature Conservancy, Arlington, United States; University of Florida; University of Queensland; Wildlife Conservation Society Fiji","Australian Institute of Marine Science; Department of Agriculture, Water and the Environment; Great Barrier Reef Marine Park Authority; National Oceanic and Atmospheric Administration; Natural Environment Research Council","9/5/2014","10.1111/gcb.12700","","","http://urn.kb.se/resolve?urn=urn:nbn:se:su:diva-113549","25196132","","","2015GCBio..21...48A","","","","","1","1","3","0","39","0","0","0","0","0","0","0","0","0","0","0","0","697","180","https://www.altmetric.com/details/2658659","https://api.altmetric.com/v1/donut/2658659_240.png","Wiley"
"39","The neglected heart of science policy: reconciling supply of and demand for science","Environmental Science & Policy","1462-9011, 1873-6416","","","Article","","closed","05 Environmental Sciences; 07 Agricultural and Veterinary Sciences; 16 Studies in Human Society; 30 Agricultural, Veterinary and Food Sciences; 41 Environmental Sciences; 44 Human Society","","Arizona State University; University of Colorado Boulder","Directorate for Social, Behavioral & Economic Sciences","2/1/2007","10.1016/j.envsci.2006.10.001","","","http://linkinghub.elsevier.com/retrieve/pii/S1462901106001183","","","","","","","","","1","2","3","0","24","0","0","0","0","0","0","0","0","1","0","0","0","654","444","https://www.altmetric.com/details/1474213","https://api.altmetric.com/v1/donut/1474213_240.png","Elsevier BV"
"31","A methodology to compute emission projections from road transport (EmiTRANS)","Technological Forecasting and Social Change","0040-1625","","","Article","1","green","10 Technology; 14 Economics; 15 Commerce, Management, Tourism and Services; 35 Commerce, Management, Tourism and Services; 38 Economics","3 Good Health and Well Being; 13 Climate Action","Technical University of Madrid","Ministerio de Agricultura y Pesca, Alimentaci贸n y Medio Ambiente","1/1/2014","10.1016/j.techfore.2013.02.011","","","","","","","","","","","","4","0","3","0","0","0","0","0","0","0","0","0","0","0","0","0","0","73","14","https://www.altmetric.com/details/2213187","https://api.altmetric.com/v1/donut/2213187_240.png","Elsevier BV"
