"6","A review on Anopheles culicifacies: From bionomics to control with special reference to Indian subcontinent","Acta Tropica","0001-706X, 1873-6254","","","Article","","closed","06 Biological Sciences; 11 Medical and Health Sciences; 31 Biological Sciences; 32 Biomedical and Clinical Sciences; 3207 Medical Microbiology","","National Institute of Malaria Research; University of Delhi","","2/1/2009","10.1016/j.actatropica.2008.09.017","","","http://linkinghub.elsevier.com/retrieve/pii/S0001706X08002635","19000647","","","","","","","","0","0","5","0","0","0","0","0","1","0","0","0","0","0","0","0","0","78","39","https://www.altmetric.com/details/15590935","https://api.altmetric.com/v1/donut/15590935_240.png","Elsevier BV"
"6","Building resilience to overheating into 1960's UK hospital buildings within the constraint of the national carbon reduction target: Adaptive strategies","Building & Environment","0360-1323, 1873-684X","","","Article","1","hybrid","05 Environmental Sciences; 0502 Environmental Science and Management; 12 Built Environment and Design; 1201 Architecture; 1202 Building; 33 Built Environment and Design; 3302 Building","7 Affordable and Clean Energy; 13 Climate Action","Loughborough University; University of Cambridge","Department of Health and Social Care; Engineering and Physical Sciences Research Council; Isaac Newton Trust","9/1/2012","10.1016/j.buildenv.2012.02.031","","","http://linkinghub.elsevier.com/retrieve/pii/S0360132312000765","","","","","","","","","0","0","5","0","0","0","0","0","0","0","0","0","0","0","0","0","0","237","52","https://www.altmetric.com/details/5404587","https://api.altmetric.com/v1/donut/5404587_240.png","Elsevier BV"
"5317","Eat less meat: UN climate-change report calls for change to human diet","Nature","0028-0836, 1476-4687","","","News","","closed","31 Biological Sciences; 41 Environmental Sciences; 4101 Climate Change Impacts and Adaptation","13 Climate Action","","","8/8/2019","10.1038/d41586-019-02409-7","","","","31409926","","","","","","","","238","36","4","0","6371","0","0","25","22","0","0","24","0","0","0","4","0","193","66","https://www.altmetric.com/details/64712554","https://api.altmetric.com/v1/donut/64712554_240.png","Scientific American; Springer Nature"
"584","Solution aversion: On the relation between ideology and motivated disbelief.","Journal of Personality & Social Psychology","0022-3514, 1939-1315","","","Article","1","green","15 Commerce, Management, Tourism and Services; 1505 Marketing; 17 Psychology and Cognitive Sciences; 1701 Psychology; 1702 Cognitive Sciences; 52 Psychology; 5204 Cognitive and Computational Psychology; 5205 Social and Personality Psychology","","Duke University","","1/1/2014","10.1037/a0037963","","","http://doi.apa.org/getdoi.cfm?doi=10.1037/a0037963","25347128","","10161/9256","","","","","","48","21","4","0","212","0","0","13","0","4","0","0","0","0","0","1","0","536","344","https://www.altmetric.com/details/2817770","https://api.altmetric.com/v1/donut/2817770_240.png","American Psychological Association (APA)"
"345","Learning to coexist with wildfire","Nature","0028-0836, 1476-4687","","","Article","","closed","05 Environmental Sciences; 0501 Ecological Applications; 0502 Environmental Science and Management; 06 Biological Sciences; 0602 Ecology; 41 Environmental Sciences; 4102 Ecological Applications","13 Climate Action","Australian National University; Centre Tecnol貌gic Forestal de Catalunya; Commonwealth Scientific and Industrial Research Organisation; RMIT University; University of California, Berkeley; University of California, Santa Barbara; University of Colorado Boulder; University of Wollongong; US Forest Service","Directorate for Biological Sciences; US Forest Service","11/5/2014","10.1038/nature13946","","","","25373675","","","2014Natur.515...58M","","","","","38","7","4","0","96","0","0","20","0","0","0","0","0","0","0","0","0","985","649","https://www.altmetric.com/details/2854678","https://api.altmetric.com/v1/donut/2854678_240.png","Scientific American; Springer Nature"
"312","Climate Exposure of US National Parks in a New Era of Change","PLOS ONE","1932-6203","","","Article","1","gold","05 Environmental Sciences; 0502 Environmental Science and Management; 37 Earth Sciences; 3701 Atmospheric Sciences; 41 Environmental Sciences","13 Climate Action","National Park Service","National Aeronautics and Space Administration; National Park Service","7/2/2014","10.1371/journal.pone.0101302","","","","24988483","","","2014PLoSO...9j1302M","","","","","26","5","4","0","66","0","0","3","1","2","0","0","0","1","0","0","0","130","64","https://www.altmetric.com/details/2481820","https://api.altmetric.com/v1/donut/2481820_240.png","Public Library of Science (PLOS)"
"263","The 'best available science' to inform 1.5 掳C policy choices","Nature Climate Change","1758-678X, 1758-6798","","","Article","","closed","04 Earth Sciences; 0401 Atmospheric Sciences; 0406 Physical Geography and Environmental Geoscience; 05 Environmental Sciences; 0502 Environmental Science and Management; 41 Environmental Sciences; 44 Human Society; 4408 Political Science","13 Climate Action","","The Research Council of Norway","4/11/2016","10.1038/nclimate3000","","","","","","","2016NatCC...6..646P","","","","","14","5","4","0","311","0","0","4","0","0","0","0","0","0","0","0","0","235","86","https://www.altmetric.com/details/6614040","https://api.altmetric.com/v1/donut/6614040_240.png","Scientific American; Springer Nature"
"176","Limiting the high impacts of Amazon forest dieback with no-regrets science and policy action","Proceedings of the National Academy of Sciences of the United States of America","0027-8424, 1091-6490","","","Article","1","bronze","05 Environmental Sciences; 0502 Environmental Science and Management; 38 Economics; 41 Environmental Sciences; 4101 Climate Change Impacts and Adaptation","13 Climate Action","Federal University of Rio Grande do Sul; International Institute for Sustainability; National Institute for Space Research; Pontifical Catholic University of Rio de Janeiro; State University of Campinas; Stockholm University; Technical University of Munich; Universidade Federal do Acre; Wageningen University & Research; Woodwell Climate Research Center; World Resources Institute","Coordena莽茫o de Aperfeicoamento de Pessoal de N铆vel Superior; National Council for Scientific and Technological Development; Natural Environment Research Council; S茫o Paulo Research Foundation","11/5/2018","10.1073/pnas.1721770115","","","","30397144","","","","","","","","17","3","4","0","52","0","0","0","0","0","0","1","0","0","0","0","0","261","38","https://www.altmetric.com/details/50869762","https://api.altmetric.com/v1/donut/50869762_240.png","Proceedings of the National Academy of Sciences (PNAS)"
"117","Preferential cooling of hot extremes from cropland albedo management","Proceedings of the National Academy of Sciences of the United States of America","0027-8424, 1091-6490","","","Article","1","bronze","05 Environmental Sciences; 0503 Soil Sciences; 37 Earth Sciences; 3701 Atmospheric Sciences","13 Climate Action","ETH Zurich; Laboratoire des Sciences du Climat et de l'Environnement; University of Avignon","European Commission; Swiss National Science Foundation","6/23/2014","10.1073/pnas.1317323111","","","","24958872","","","2014PNAS..111.9757D","","","","","11","2","4","0","9","0","0","0","0","0","0","0","0","0","0","0","0","283","145","https://www.altmetric.com/details/2459793","https://api.altmetric.com/v1/donut/2459793_240.png","Proceedings of the National Academy of Sciences (PNAS)"
"83","Huge gaps in detection networks plague emissions monitoring","Nature","0028-0836, 1476-4687","","","News","1","bronze","41 Environmental Sciences; 48 Law and Legal Studies; 4802 Environmental and Resources Law","13 Climate Action","","","7/19/2021","10.1038/d41586-021-01967-z","","","","34282339","","","","","","","","3","0","4","0","91","0","0","1","0","0","0","4","0","0","0","0","0","6","4","https://www.altmetric.com/details/109930394","https://api.altmetric.com/v1/donut/109930394_240.png","Scientific American; Springer Nature"
"74","The Delphi technique in ecology and biological conservation: applications and guidelines","Methods in Ecology and Evolution","2041-210X","","","Article","1","bronze","05 Environmental Sciences; 0502 Environmental Science and Management; 41 Environmental Sciences; 4104 Environmental Management","","Ghent University; Massey University; Universit茅 Libre de Bruxelles; University of Cambridge; Vrije Universiteit Brussel","National Science Foundation","4/28/2015","10.1111/2041-210x.12387","","","http://doi.wiley.com/10.1111/2041-210X.12387","","","","","","","","","4","10","4","0","69","0","0","4","0","0","0","0","0","0","0","0","0","520","198","https://www.altmetric.com/details/3881295","https://api.altmetric.com/v1/donut/3881295_240.png","Wiley"
"50","Life cycle assessment of onshore and offshore wind energy-from theory to application","Applied Energy","0306-2619","","","Article","1","green","09 Engineering; 14 Economics; 33 Built Environment and Design; 38 Economics; 40 Engineering","7 Affordable and Clean Energy; 13 Climate Action","Technical University of Denmark","Innovation Fund Denmark","10/1/2016","10.1016/j.apenergy.2016.07.058","","","","","","","","","","","","3","2","4","0","15","0","0","0","0","0","0","0","0","0","0","0","0","493","136","https://www.altmetric.com/details/10350849","https://api.altmetric.com/v1/donut/10350849_240.png","Elsevier BV"
"50","Modeling meets science and technology: an introduction to a special issue on negative emissions","Climatic Change","0165-0009, 1573-1480","","","Article","1","hybrid","01 Mathematical Sciences; 0103 Numerical and Computational Mathematics; 41 Environmental Sciences; 4104 Environmental Management","13 Climate Action","Fondazione Eni Enrico Mattei; Princeton University","","4/17/2013","10.1007/s10584-013-0757-9","","","","","","","2013ClCh..118....1T","","","","","1","3","4","0","12","0","0","0","1","0","0","0","0","0","0","0","0","204","109","https://www.altmetric.com/details/1394187","https://api.altmetric.com/v1/donut/1394187_240.png","Springer Nature"
"45","Learning about climate change solutions in the IPCC and beyond","Environmental Science & Policy","1462-9011, 1873-6416","","","Article","","closed","16 Studies in Human Society; 1605 Policy and Administration; 44 Human Society; 4407 Policy and Administration","13 Climate Action","Hertie School; Mercator Research Institute on Global Commons and Climate Change; Potsdam Institute for Climate Impact Research; Technical University of Berlin","","11/1/2017","10.1016/j.envsci.2017.05.014","","","","","","","","","","","","1","1","4","0","42","0","0","0","0","0","0","0","0","0","0","0","0","220","105","https://www.altmetric.com/details/20963999","https://api.altmetric.com/v1/donut/20963999_240.png","Elsevier BV"
"33","A Range-Based Vehicle Life Cycle Assessment Incorporating Variability in the Environmental Assessment of Different Vehicle Technologies and Fuels","Energies","1996-1073","","","Article","1","gold","02 Physical Sciences; 09 Engineering; 40 Engineering","7 Affordable and Clean Energy","","","3/11/2014","10.3390/en7031467","","","","","","","","","","","","0","0","4","0","24","0","0","0","1","0","0","0","0","0","0","0","0","339","125","https://www.altmetric.com/details/4122349","https://api.altmetric.com/v1/donut/4122349_240.png","MDPI"
"31","Policy Implications of Uncertainty in Modeled Life-Cycle Greenhouse Gas Emissions of Biofuels","Environmental Science & Technology","0013-936X, 1520-5851","","","Article","1","bronze","14 Economics; 1402 Applied Economics; 31 Biological Sciences; 3106 Industrial Biotechnology; 38 Economics; 41 Environmental Sciences; 4104 Environmental Management","13 Climate Action","","Directorate for Social, Behavioral & Economic Sciences","12/1/2010","10.1021/es1024993","","","","21121672","","","2011EnST...45..132M","","","","","1","1","4","0","1","0","0","0","0","0","0","0","0","0","0","0","0","181","99","https://www.altmetric.com/details/1101299","https://api.altmetric.com/v1/donut/1101299_240.png","American Chemical Society (ACS)"
"29","Exploring pathways for sustainable water management in river deltas in a changing environment","Climatic Change","0165-0009, 1573-1480","","","Article","1","hybrid","04 Earth Sciences; 0406 Physical Geography and Environmental Geoscience; 05 Environmental Sciences; 0502 Environmental Science and Management; 41 Environmental Sciences; 4101 Climate Change Impacts and Adaptation","13 Climate Action","Deltares; University of Twente; Utrecht University","","3/24/2012","10.1007/s10584-012-0444-2","","","","","","","","","","","","1","1","4","0","4","0","0","0","0","0","0","0","0","0","0","0","0","376","240","https://www.altmetric.com/details/671875","https://api.altmetric.com/v1/donut/671875_240.png","Springer Nature"
"27","The circular bioeconomy: Its elements and role in European bioeconomy clusters","Resources, Conservation & Recycling: X","","","","Article","1","gold","16 Studies in Human Society; 1605 Policy and Administration; 38 Economics; 3801 Applied Economics; 40 Engineering; 4011 Environmental Engineering","","Utrecht University","Ministry of Economic Affairs and Climate Policy","5/1/2020","10.1016/j.rcrx.2019.100029","","","","","","","","","","","","1","0","4","0","12","0","0","1","0","0","0","0","0","0","0","0","0","827","320","https://www.altmetric.com/details/74299344","https://api.altmetric.com/v1/donut/74299344_240.png","Elsevier BV"
"24","The art of co-production of knowledge in environmental sciences and management: lessons from international practice","Environmental Management","0364-152X, 1432-1009","","","Article","1","hybrid","16 Studies in Human Society; 1608 Sociology; 39 Education; 46 Information and Computing Sciences; 4610 Library and Information Studies","","Michigan State University; University of Arizona","United States Geological Survey","4/5/2018","10.1007/s00267-018-1028-3","","","","29623401","","","2018EnMan..61..885D","","","","","0","0","4","0","29","0","0","0","0","0","0","0","0","0","0","0","0","549","197","https://www.altmetric.com/details/36166283","https://api.altmetric.com/v1/donut/36166283_240.png","Springer Nature"
"22","Adaptation to climate change at local level in Europe: An overview","Environmental Science & Policy","1462-9011, 1873-6416","","","Article","","closed","16 Studies in Human Society; 1604 Human Geography; 41 Environmental Sciences; 4101 Climate Change Impacts and Adaptation","13 Climate Action","University of Lisbon; Wageningen University & Research","European Commission; Funda莽茫o para a Ci锚ncia e Tecnologia","8/1/2018","10.1016/j.envsci.2018.04.010","","","","","","","","","","","","0","1","4","0","5","0","0","5","0","0","0","0","0","0","0","0","0","437","138","https://www.altmetric.com/details/41158243","https://api.altmetric.com/v1/donut/41158243_240.png","Elsevier BV"
"22","Managing private and public adaptation to climate change","Global Environmental Change Part A: Human & Policy Dimensions","0959-3780","","","Article","1","hybrid","14 Economics; 1402 Applied Economics; 41 Environmental Sciences; 4101 Climate Change Impacts and Adaptation; 44 Human Society","13 Climate Action","Arizona State University; University of Southampton","","2/1/2012","10.1016/j.gloenvcha.2011.09.010","","","","","","","","","","","","0","1","4","0","3","0","0","0","0","0","0","0","0","0","0","0","0","514","168","https://www.altmetric.com/details/1446586","https://api.altmetric.com/v1/donut/1446586_240.png","Elsevier BV"
"20","Using the sun to decarbonize the power sector: The economic potential of photovoltaics and concentrating solar power","Applied Energy","0306-2619","","","Article","1","green","09 Engineering; 0906 Electrical and Electronic Engineering; 40 Engineering; 4008 Electrical Engineering","7 Affordable and Clean Energy; 13 Climate Action","German Aerospace Center; Potsdam Institute for Climate Impact Research; Technical University of Berlin","European Commission","12/1/2014","10.1016/j.apenergy.2014.08.011","","","http://linkinghub.elsevier.com/retrieve/pii/S0306261914008149","","","","","","","","","0","0","4","0","15","0","0","0","2","0","0","0","0","0","0","0","0","213","134","https://www.altmetric.com/details/2671642","https://api.altmetric.com/v1/donut/2671642_240.png","Elsevier BV"
"18","New Perspectives in Monitoring Drinking Water Microbial Quality","International Journal of Environmental Research and Public Health","1661-7827, 1660-4601","","","Article","1","gold","06 Biological Sciences; 0605 Microbiology; 11 Medical and Health Sciences; 1117 Public Health and Health Services; 42 Health Sciences; 4203 Health Services and Systems","6 Clean Water and Sanitation","University of Malaga","European Commission","12/10/2010","10.3390/ijerph7124179","","","","21318002","PMC3037048","","","","","","","0","1","4","0","0","0","0","0","0","0","0","0","0","0","0","0","0","460","148","https://www.altmetric.com/details/10399362","https://api.altmetric.com/v1/donut/10399362_240.png","MDPI"
"18","From Acid Rain to Climate Change","Science","0036-8075, 1095-9203","","","Article","","closed","05 Environmental Sciences; 0502 Environmental Science and Management; 41 Environmental Sciences; 4105 Pollution and Contamination","13 Climate Action","Federal Ministry for the Environment, Nature Conservation, Nuclear Safety and Consumer Protection; Imperial College London; International Institute for Applied Systems Analysis; IVL - Swedish Environmental Research Institute; King's College London; National Institute for Public Health and the Environment; UK Centre for Ecology & Hydrology","","11/30/2012","10.1126/science.1226514","","","http://www.sciencemag.org/cgi/doi/10.1126/science.1226514","23197517","","","2012Sci...338.1153R","","","","","0","0","4","0","17","0","0","1","0","0","0","0","0","0","0","0","0","164","119","https://www.altmetric.com/details/1100711","https://api.altmetric.com/v1/donut/1100711_240.png","American Association for the Advancement of Science (AAAS)"
"18","Linking Forest Tenure Reform, Environmental Compliance, and Incentives: Lessons from REDD+ Initiatives in the Brazilian Amazon","World Development","0305-750X","","","Article","","closed","14 Economics; 1402 Applied Economics; 16 Studies in Human Society; 1605 Policy and Administration; 44 Human Society; 4404 Development Studies","","Center for International Forestry Research, Lima, Peru; Center for International Forestry Research, Bogor, Indonesia; Funda莽茫o Getulio Vargas; North Carolina State University; Norwegian University of Life Sciences; Universidade do Estado de Santa Catarina; Universidade Federal do Acre; Universidade Federal Rural do Rio de Janeiro; University of Florida","United States Agency for International Development","3/1/2014","10.1016/j.worlddev.2013.01.014","","","http://linkinghub.elsevier.com/retrieve/pii/S0305750X1300020X","","","","","","","","","0","1","4","0","0","0","0","0","0","0","0","0","0","0","0","0","0","379","111","https://www.altmetric.com/details/4755322","https://api.altmetric.com/v1/donut/4755322_240.png","Elsevier BV"
"16","Focus on environmental risks and migration: causes and consequences","Environmental Research Letters (ERL)","1748-9326","","","Article","1","gold","16 Studies in Human Society; 1604 Human Geography; 41 Environmental Sciences; 44 Human Society; 4406 Human Geography","13 Climate Action","School of Oriental and African Studies; University of Exeter; University of Oxford; University of Reading; University of Sheffield","Department for Business, Energy and Industrial Strategy","6/16/2015","10.1088/1748-9326/10/6/060201","","","http://stacks.iop.org/1748-9326/10/i=6/a=060201?key=crossref.6a2fdaa52a17c88837f4bc24237a864b","","","10871/19419","2015ERL....10f0201A","","","","","0","0","4","0","16","0","0","0","0","0","0","0","0","0","0","0","0","221","97","https://www.altmetric.com/details/4169009","https://api.altmetric.com/v1/donut/4169009_240.png","IOP Publishing"
"14","","Climatic Change","0165-0009, 1573-1480","","","Article","","closed","04 Earth Sciences; 0406 Physical Geography and Environmental Geoscience; 06 Biological Sciences; 0602 Ecology; 0699 Other Biological Sciences; 37 Earth Sciences; 3701 Atmospheric Sciences","13 Climate Action","Harvard University; Pacific Northwest Research Station; University of Vermont; University of Washington; US Forest Service","United States Department of Agriculture; US Forest Service","1/1/2003","10.1023/a:1026302914358","","","","","","","","","","","","0","1","4","0","0","0","0","0","0","0","0","0","0","0","0","0","0","235","258","https://www.altmetric.com/details/21551470","https://api.altmetric.com/v1/donut/21551470_240.png","Springer Nature"
"14","Responding to the challenges of climate change in the Pacific Islands: management and technological imperatives","Climate Research","0936-577X, 1616-1572","","","Article","1","bronze","04 Earth Sciences; 0401 Atmospheric Sciences; 05 Environmental Sciences; 0502 Environmental Science and Management; 37 Earth Sciences; 3702 Climate Change Science","13 Climate Action","","","12/10/2009","10.3354/cr00806","","","","","","","2009ClRes..40..211N","","","","","0","1","4","0","0","0","0","0","0","0","0","0","0","0","0","0","0","201","142","https://www.altmetric.com/details/8265365","https://api.altmetric.com/v1/donut/8265365_240.png",""
"14","The search for signs of recovery of the ozone layer","Nature","0028-0836, 1476-4687","","","Article","","closed","03 Chemical Sciences; 0399 Other Chemical Sciences; 37 Earth Sciences; 3701 Atmospheric Sciences","","Cooperative Institute for Research in Environmental Sciences; Danish Meteorological Institute","Danish National Research Foundation; Environmental Protection Agency, Washington D.C., United States; European Commission; National Oceanic and Atmospheric Administration","5/1/2006","10.1038/nature04746","","","http://www.nature.com/doifinder/10.1038/nature04746","16672963","","","2006Natur.441...39W","","","","","0","0","4","0","2","0","0","0","2","0","0","0","0","0","0","0","0","198","236","https://www.altmetric.com/details/1870687","https://api.altmetric.com/v1/donut/1870687_240.png","Scientific American; Springer Nature"
"14","Unraveling the Relationships between Ecosystems and Human Wellbeing in Spain","PLOS ONE","1932-6203","","","Article","1","gold","05 Environmental Sciences; 0502 Environmental Science and Management; 41 Environmental Sciences; 4104 Environmental Management","15 Life on Land","Autonomous University of Madrid; Carlos III University of Madrid","Ministerio de Agricultura y Pesca, Alimentaci贸n y Medio Ambiente","9/5/2013","10.1371/journal.pone.0073249","","","http://dx.plos.org/10.1371/journal.pone.0073249","24039894","","","2013PLoSO...873249S","","","","","0","0","4","0","16","0","0","2","0","0","0","0","0","0","0","0","0","322","91","https://www.altmetric.com/details/1738085","https://api.altmetric.com/v1/donut/1738085_240.png","Public Library of Science (PLOS)"
"13","U.S. Natural Resources and Climate Change: Concepts and Approaches for Management Adaptation","Environmental Management","0364-152X, 1432-1009","","","Article","1","hybrid","05 Environmental Sciences; 0501 Ecological Applications; 0502 Environmental Science and Management; 06 Biological Sciences; 0602 Ecology; 41 Environmental Sciences; 4102 Ecological Applications","13 Climate Action","Environmental Protection Agency, Washington D.C., United States; The Nature Conservancy, Arlington, United States; University of California, San Diego; University of California, Santa Cruz; University of Washington","Environmental Protection Agency, Washington D.C., United States","7/28/2009","10.1007/s00267-009-9345-1","","","","19636606","PMC2791483","","","","","","","0","0","4","0","1","0","0","0","0","0","0","0","0","0","0","0","0","338","128","https://www.altmetric.com/details/547397","https://api.altmetric.com/v1/donut/547397_240.png","Springer Nature"
"12","Differentiation of countries鈥?future commitments in a post-2012 climate regime","Environmental Science & Policy","1462-9011, 1873-6416","","","Article","","closed","16 Studies in Human Society; 1606 Political Science; 44 Human Society; 4404 Development Studies","13 Climate Action","Netherlands Environmental Assessment Agency; University of Cape Town; Wuppertal Institute for Climate, Environment and Energy","","5/1/2007","10.1016/j.envsci.2006.10.009","","","","","","","","","","","","0","0","4","0","0","0","0","0","0","0","0","0","0","0","0","0","0","53","47","https://www.altmetric.com/details/47925874","https://api.altmetric.com/v1/donut/47925874_240.png","Elsevier BV"
"12","Community Capacity for Adaptation to Climate-Induced Water Shortages: Linking Institutional Complexity and Local Actors","Environmental Management","0364-152X, 1432-1009","","","Chapter","","closed","16 Studies in Human Society; 1604 Human Geography; 44 Human Society; 4406 Human Geography","13 Climate Action","University of Guelph","Natural Resources Canada","1/1/2004","10.1007/s00267-003-0014-5","","","https://link.springer.com/article/10.1007/s00267-003-0014-5","14743290","","","","","","","","0","0","4","0","0","0","0","0","2","0","0","0","0","0","0","0","0","236","106","https://www.altmetric.com/details/3635170","https://api.altmetric.com/v1/donut/3635170_240.png","Springer Nature"
