"Altmetric Attention Score","Title","Journal/Collection Title","Journal ISSNs","Authors at my Institution","Departments","Output Type","OA Status","OA Type","Subjects (FoR)","Sustainable Development Goals","Affiliations (GRID)","Funder","Publication Date","DOI","ISBN","National Clinical Trial ID","URI","PubMed ID","PubMedCentral ID","Handle.net IDs","ADS Bibcode","arXiv ID","RePEc ID","SSRN","URN","News mentions","Blog mentions","Policy mentions","Patent mentions","Twitter mentions","Peer review mentions","Weibo mentions","Facebook mentions","Wikipedia mentions","Google+ mentions","LinkedIn mentions","Reddit mentions","Pinterest mentions","F1000 mentions","Q&A mentions","Video mentions","Syllabi mentions","Number of Mendeley readers","Number of Dimensions citations","Details Page URL","Badge URL","Publisher Names"
"549","Climate change 2013","","","","","Book","1","green","04 Earth Sciences; 0401 Atmospheric Sciences; 37 Earth Sciences; 3701 Atmospheric Sciences","13 Climate Action","","","1/1/2009","10.1017/cbo9781107415324","9781107415324","","http://books.google.com/books?id=o4gaBQAAQBAJ&hl=&source=gbs_api","","","","","","","","","37","16","151","1","140","0","0","2","67","0","0","0","0","0","1","0","0","12764","6238","https://www.altmetric.com/details/4252201","https://api.altmetric.com/v1/donut/4252201_240.png","Cambridge University Press"
"722","Global food demand and the sustainable intensification of agriculture","Proceedings of the National Academy of Sciences of the United States of America","0027-8424, 1091-6490","","","Article","1","bronze","05 Environmental Sciences; 0502 Environmental Science and Management; 30 Agricultural, Veterinary and Food Sciences; 3002 Agriculture, Land and Farm Management; 3004 Crop and Pasture Production; 38 Economics","2 Zero Hunger; 13 Climate Action","University of California, Santa Barbara; University of Minnesota","Directorate for Biological Sciences","11/21/2011","10.1073/pnas.1116437108","","","http://www.pnas.org/content/108/50/20260.full","22106295","","10568/42922","2011PNAS..10820260T","","","","","69","46","47","7","54","0","1","5","5","5","0","0","0","0","0","0","0","7414","4635","https://www.altmetric.com/details/464986","https://api.altmetric.com/v1/donut/464986_240.png","Proceedings of the National Academy of Sciences (PNAS)"
"85","Integrated landscape approaches to managing social and environmental issues in the tropics: learning from the past to guide the future","Global Change Biology","1354-1013, 1365-2486","","","Article","1","hybrid","05 Environmental Sciences; 0502 Environmental Science and Management; 41 Environmental Sciences; 4102 Ecological Applications","2 Zero Hunger","Center for International Forestry Research, Bogor, Indonesia; James Cook University; Lancaster University; Opus International Consultants (New Zealand)","United States Agency for International Development","4/25/2016","10.1111/gcb.13284","","","http://doi.wiley.com/10.1111/gcb.13284","26990574","","","2016GCBio..22.2540R","","","","","1","22","31","0","61","0","0","1","2","1","0","0","0","1","0","0","0","695","243","https://www.altmetric.com/details/6205675","https://api.altmetric.com/v1/donut/6205675_240.png","Wiley"
"74","Social Capital, Collective Action, and Adaptation to Climate Change","Economic Geography","0013-0095, 1944-8287","","","Article","","closed","16 Studies in Human Society; 1608 Sociology; 44 Human Society; 4406 Human Geography","13 Climate Action","University of East Anglia","","2/16/2009","10.1111/j.1944-8287.2003.tb00220.x","","","http://doi.wiley.com/10.1111/j.1944-8287.2003.tb00220.x","","","","","","","","","2","2","30","0","0","0","0","0","0","0","0","0","0","0","0","0","0","2667","1476","https://www.altmetric.com/details/2822361","https://api.altmetric.com/v1/donut/2822361_240.png","Wiley"
"10759","Climate tipping points 鈥?too risky to bet against","Nature","0028-0836, 1476-4687","","","News","1","green","38 Economics; 44 Human Society; 4408 Political Science","13 Climate Action","","European Research Council","11/27/2019","10.1038/d41586-019-03595-0","","","","31776487","","","2019Natur.575..592L","","","","","546","147","26","0","19708","0","0","60","58","0","0","27","0","1","1","6","0","1431","1041","https://www.altmetric.com/details/71296068","https://api.altmetric.com/v1/donut/71296068_240.png","Scientific American; Springer Nature"
"2099","The 2018 report of the Lancet Countdown on health and climate change: shaping the health of nations for centuries to come","The Lancet","0099-5355, 0140-6736, 1474-547X","","","Article","1","green","11 Medical and Health Sciences; 42 Health Sciences; 4206 Public Health","13 Climate Action","Agricultural Biotechnology Research Institute of Iran; Atlantic Oceanographic and Meteorological Laboratory; Cayetano Heredia University; Centre for Environment, Fisheries and Aquaculture Science; Centre Virchow-Villerm茅; Cooperative Institute for Research in Environmental Sciences; Heidelberg University, Heidelberg, Germany; Imperial College London; International Institute for Applied Systems Analysis; International Livestock Research Institute; Iran University of Medical Sciences; London School of Hygiene & Tropical Medicine; Nelson Marlborough Institute of Technology; The University of Sydney; Tsinghua University; Ume氓 University; University College London; University of Birmingham; University of Colorado Boulder; University of Essex; University of Exeter; University of Geneva; University of New England, Biddeford, United States; University of North Texas; University of Reading; University of Sussex; University of Washington; University of York; World Bank; World Health Organization","Engineering and Physical Sciences Research Council; Medical Research Council; National Oceanic and Atmospheric Administration; Wellcome Trust; World Health Organization","12/1/2018","10.1016/s0140-6736(18)32594-7","","","","30503045","","10568/98388","","","","","","225","31","25","0","1357","0","0","17","4","0","0","1","0","1","0","0","0","1071","549","https://www.altmetric.com/details/51888253","https://api.altmetric.com/v1/donut/51888253_240.png","Elsevier BV; StatRef"
"831","Old-growth forests as global carbon sinks","Nature","0028-0836, 1476-4687","","","Article","1","green","05 Environmental Sciences; 0503 Soil Sciences; 06 Biological Sciences; 0699 Other Biological Sciences; 07 Agricultural and Veterinary Sciences; 0705 Forestry Sciences; 30 Agricultural, Veterinary and Food Sciences; 3007 Forestry Sciences","","ETH Zurich; Laboratoire des Sciences du Climat et de l'Environnement; Max Planck Institute for Biogeochemistry; Oregon State University; University of Antwerp; University of Edinburgh","European Commission; Natural Environment Research Council; Office of Biological and Environmental Research; Research Foundation - Flanders; United States Army Corps of Engineers","9/11/2008","10.1038/nature07276","","","http://www.nature.com/doifinder/10.1038/nature07276","18784722","","","2008Natur.455..213L","","","","","61","12","25","0","602","0","0","3","15","1","0","0","0","3","0","1","0","1958","1266","https://www.altmetric.com/details/515728","https://api.altmetric.com/v1/donut/515728_240.png","Scientific American; Springer Nature"
"2445","Restoring natural forests is the best way to remove atmospheric carbon","Nature","0028-0836, 1476-4687","","","News","1","bronze","30 Agricultural, Veterinary and Food Sciences; 3007 Forestry Sciences; 50 Philosophy and Religious Studies","13 Climate Action","","","4/2/2019","10.1038/d41586-019-01026-8","","","","30940972","","","","","","","","167","36","24","0","2486","0","0","31","1","0","0","5","0","0","0","1","0","773","429","https://www.altmetric.com/details/58345405","https://api.altmetric.com/v1/donut/58345405_240.png","Scientific American; Springer Nature"
"28","Reducing hazard vulnerability: towards a common approach between disaster risk reduction and climate adaptation","Disasters","0361-3666, 1467-7717","","","Article","","closed","16 Studies in Human Society; 1604 Human Geography; 35 Commerce, Management, Tourism and Services; 3507 Strategy, Management and Organisational Behaviour","1 No Poverty; 13 Climate Action","Stockholm Environment Institute, Stockholm, Sweden; Union of Concerned Scientists","","3/1/2006","10.1111/j.1467-9523.2006.00305.x","","","http://doi.wiley.com/10.1111/j.1467-9523.2006.00305.x","16512860","","","","","","","","0","0","24","0","0","0","0","1","0","0","0","0","0","0","0","0","0","979","453","https://www.altmetric.com/details/998354","https://api.altmetric.com/v1/donut/998354_240.png","Wiley"
"674","RCP 8.5鈥擜 scenario of comparatively high greenhouse gas emissions","Climatic Change","0165-0009, 1573-1480","","","Article","1","hybrid","14 Economics; 1402 Applied Economics; 37 Earth Sciences; 3701 Atmospheric Sciences; 38 Economics","13 Climate Action","International Institute for Applied Systems Analysis","","8/13/2011","10.1007/s10584-011-0149-y","","","http://link.springer.com/10.1007/s10584-011-0149-y","","","","","","","","","130","77","22","0","127","0","0","2","2","1","0","0","0","0","0","0","0","2166","2119","https://www.altmetric.com/details/1841420","https://api.altmetric.com/v1/donut/1841420_240.png","Springer Nature"
"303","RCP2.6: exploring the possibility to keep global mean temperature increase below 2掳C","Climatic Change","0165-0009, 1573-1480","","","Article","1","hybrid","09 Engineering; 0915 Interdisciplinary Engineering; 37 Earth Sciences; 3701 Atmospheric Sciences; 41 Environmental Sciences","13 Climate Action","Utrecht University","","8/5/2011","10.1007/s10584-011-0152-3","","","","","","","","","","","","103","44","17","0","24","0","0","0","0","0","0","0","0","0","0","0","0","997","717","https://www.altmetric.com/details/1878952","https://api.altmetric.com/v1/donut/1878952_240.png","Springer Nature"
"268","Climate Change, Human Impacts, and the Resilience of Coral Reefs","Science","0036-8075, 1095-9203","","","Article","","closed","05 Environmental Sciences; 0501 Ecological Applications; 0502 Environmental Science and Management; 06 Biological Sciences; 0602 Ecology; 0699 Other Biological Sciences; 31 Biological Sciences; 3103 Ecology; 41 Environmental Sciences; 4101 Climate Change Impacts and Adaptation; 4104 Environmental Management","13 Climate Action","Australian Institute of Marine Science; Great Barrier Reef Marine Park Authority; James Cook University; National Center for Atmospheric Research; National Museum of Natural History, Washington D.C., United States; Natural History Museum; Scripps Institution of Oceanography; Smithsonian Tropical Research Institute; Stanford University; Stockholm University; University of California, Davis; University of Queensland","National Institute of Food and Agriculture","8/15/2003","10.1126/science.1085046","","","http://www.sciencemag.org/cgi/doi/10.1126/science.1085046","12920289","","","2003Sci...301..929H","","","","","11","7","17","0","204","0","0","0","15","1","0","0","0","0","0","0","0","4486","2762","https://www.altmetric.com/details/1333532","https://api.altmetric.com/v1/donut/1333532_240.png","American Association for the Advancement of Science (AAAS)"
"144","The science, policy and practice of nature-based solutions: An interdisciplinary perspective","Science of the Total Environment","0048-9697, 1879-1026","","","Article","1","hybrid","16 Studies in Human Society; 1605 Policy and Administration; 35 Commerce, Management, Tourism and Services; 41 Environmental Sciences; 4104 Environmental Management","","Estonian University of Life Sciences; European Centre for Nature Conservation; European Regional Centre for Ecohydrology; Finnish Environment Institute; German Center for Integrative Biodiversity Research; Grenoble Alpes University; Helmholtz Centre for Environmental Research; Humboldt-Universit盲t zu Berlin; James Hutton Institute; Magyar Agr谩r- 茅s 脡lettudom谩nyi Egyetem; Norwegian Institute for Nature Research; University of Antwerp; Wageningen University & Research","European Commission; Scottish Government","2/1/2017","10.1016/j.scitotenv.2016.11.106","","","","27919556","","","2017ScTEn.579.1215N","","","","","5","3","17","0","108","0","0","2","0","0","0","0","0","0","0","0","0","1644","659","https://www.altmetric.com/details/14532903","https://api.altmetric.com/v1/donut/14532903_240.png","Elsevier BV"
"1727","The trouble with negative emissions","Science","0036-8075, 1095-9203","","","Article","1","green","06 Biological Sciences; 0699 Other Biological Sciences; 48 Law and Legal Studies; 4802 Environmental and Resources Law","13 Climate Action","CICERO Center for International Climate Research; Uppsala University","The Research Council of Norway","10/14/2016","10.1126/science.aah4567","","","http://www.sciencemag.org/cgi/doi/10.1126/science.aah4567","27738161","","11250/2491451","2016Sci...354..182A","","","","","113","30","16","0","2206","0","0","8","9","6","0","4","0","0","0","0","0","952","809","https://www.altmetric.com/details/12601082","https://api.altmetric.com/v1/donut/12601082_240.png","American Association for the Advancement of Science (AAAS)"
"175","Titled Amazon Indigenous Communities Cut Forest Carbon Emissions","Ecological Economics","0921-8009","","","Article","","closed","05 Environmental Sciences; 0502 Environmental Science and Management; 31 Biological Sciences; 3103 Ecology; 38 Economics; 3801 Applied Economics","13 Climate Action","Inter-American Development Bank; Resources For The Future; World Resources Institute","National Aeronautics and Space Administration","11/1/2018","10.1016/j.ecolecon.2018.06.016","","","","","","","","","RePEc:eee:ecolec:v:153:y:2018:i:c:p:56-67","","","13","5","15","0","87","0","0","1","3","0","0","0","0","0","0","0","0","166","54","https://www.altmetric.com/details/44882681","https://api.altmetric.com/v1/donut/44882681_240.png","Elsevier BV"
"25","Distributional effects of taxing transport fuel","Energy Policy","0301-4215","","","Article","","closed","14 Economics; 1402 Applied Economics; 33 Built Environment and Design; 3304 Urban and Regional Planning; 44 Human Society; 4407 Policy and Administration; 48 Law and Legal Studies; 4802 Environmental and Resources Law","","University of Gothenburg","","2/1/2012","10.1016/j.enpol.2010.03.012","","","http://linkinghub.elsevier.com/retrieve/pii/S0301421510001758","","","","","","","","","0","0","14","0","1","0","0","0","0","0","0","0","0","0","0","0","0","171","117","https://www.altmetric.com/details/16272132","https://api.altmetric.com/v1/donut/16272132_240.png","Elsevier BV"
"21","Getting REDD to work locally: lessons learned from integrated conservation and development projects","Environmental Science & Policy","1462-9011, 1873-6416","","","Article","","closed","16 Studies in Human Society; 1608 Sociology; 44 Human Society","","Center for International Forestry Research, Bogor, Indonesia; Yale University","John D. and Catherine T. MacArthur Foundation","4/1/2010","10.1016/j.envsci.2010.01.002","","","http://linkinghub.elsevier.com/retrieve/pii/S1462901110000043","","","","","","","","","0","0","14","0","0","0","0","0","0","0","0","0","0","0","0","0","0","661","228","https://www.altmetric.com/details/5588303","https://api.altmetric.com/v1/donut/5588303_240.png","Elsevier BV"
"1330","One-third of global protected land is under intense human pressure","Science","0036-8075, 1095-9203","","","Article","1","bronze","05 Environmental Sciences; 0502 Environmental Science and Management; 06 Biological Sciences; 0602 Ecology; 41 Environmental Sciences; 4104 Environmental Management","15 Life on Land","University of Northern British Columbia; University of Queensland; Wildlife Conservation Society","","5/18/2018","10.1126/science.aap9565","","","","29773750","","","","","","","","131","21","13","0","995","0","0","6","1","6","0","3","0","1","0","0","0","1123","485","https://www.altmetric.com/details/41851859","https://api.altmetric.com/v1/donut/41851859_240.png","American Association for the Advancement of Science (AAAS)"
"508","Preparing ocean governance for species on the move","Science","0036-8075, 1095-9203","","","Article","1","green","04 Earth Sciences; 0405 Oceanography; 06 Biological Sciences; 0602 Ecology; 41 Environmental Sciences; 4104 Environmental Management; 48 Law and Legal Studies; 4803 International and Comparative Law","","ARC Centre of Excellence for Coral Reef Studies; Cardiff University; Rutgers, The State University of New Jersey; Stockholm University; University of British Columbia; Utrecht University","Alfred P. Sloan Foundation; Directorate for Biological Sciences; Directorate for Geosciences; National Oceanic and Atmospheric Administration; NordForsk","6/15/2018","10.1126/science.aat2360","","","","29903965","","","2018Sci...360.1189P","","","","","35","4","13","0","491","0","0","4","0","1","0","1","0","0","0","0","0","372","243","https://www.altmetric.com/details/43712531","https://api.altmetric.com/v1/donut/43712531_240.png","American Association for the Advancement of Science (AAAS)"
"130","Natural capital and ecosystem services informing decisions: From promise to practice","Proceedings of the National Academy of Sciences of the United States of America","0027-8424, 1091-6490","","","Article","1","bronze","05 Environmental Sciences; 0502 Environmental Science and Management; 16 Studies in Human Society; 1605 Policy and Administration; 38 Economics; 41 Environmental Sciences; 4104 Environmental Management","16 Peace, Justice and Strong Institutions","Council for Scientific and Industrial Research, Pretoria, South Africa; Oregon State University; Research Center for Eco-Environmental Sciences; Royal Swedish Academy of Sciences; Stanford University; Stockholm University; The Nature Conservancy, Arlington, United States; University of Cambridge; University of East Anglia; University of Minnesota; University of Vermont; University of Washington; World Wide Fund for Nature, Woking, United Kingdom; World Wide Fund for Nature, Washington D.C., United States; Xi'an Jiaotong University","","6/15/2015","10.1073/pnas.1503751112","","","http://urn.kb.se/resolve?urn=urn:nbn:se:su:diva-118953","26082539","","","2015PNAS..112.7348G","","","","","6","3","12","0","71","0","0","1","0","0","0","0","0","1","0","0","0","1977","637","https://www.altmetric.com/details/4170629","https://api.altmetric.com/v1/donut/4170629_240.png","Proceedings of the National Academy of Sciences (PNAS)"
"114","Bridging indigenous and scientific knowledge","Science","0036-8075, 1095-9203","","","Article","1","green","05 Environmental Sciences; 0502 Environmental Science and Management; 41 Environmental Sciences; 4104 Environmental Management","15 Life on Land","Royal Holloway University of London; The Open University","","6/10/2016","10.1126/science.aaf1160","","","","27284180","","","2016Sci...352.1274M","","","","","3","2","12","0","106","0","0","4","0","4","0","0","0","0","0","0","0","484","206","https://www.altmetric.com/details/8618592","https://api.altmetric.com/v1/donut/8618592_240.png","American Association for the Advancement of Science (AAAS)"
"15","An Approach for Assessing Human Health Vulnerability and Public Health Interventions to Adapt to Climate Change","Environmental Health Perspectives","0091-6765, 1552-9924","","","Article","1","gold","11 Medical and Health Sciences; 1117 Public Health and Health Services; 41 Environmental Sciences; 4101 Climate Change Impacts and Adaptation; 42 Health Sciences","13 Climate Action","London School of Hygiene & Tropical Medicine; World Health Organization - Italy","World Health Organization","12/1/2006","10.1289/ehp.8430","","","http://www.ncbi.nlm.nih.gov/pmc/articles/PMC1764166/","17185287","PMC1764166","","","","","","","0","0","12","0","0","0","0","0","0","0","0","0","0","0","0","0","0","387","205","https://www.altmetric.com/details/2432826","https://api.altmetric.com/v1/donut/2432826_240.png","National Institute of Environmental Health Services"
"24","Integrating mitigation and adaptation into climate and development policy: three research questions","Environmental Science & Policy","1462-9011, 1873-6416","","","Article","","closed","05 Environmental Sciences; 07 Agricultural and Veterinary Sciences; 16 Studies in Human Society; 41 Environmental Sciences; 4101 Climate Change Impacts and Adaptation","13 Climate Action","International Water Management Institute, Colombo, Sri Lanka; Potsdam Institute for Climate Impact Research; Stockholm Environment Institute, Oxford, United Kingdom; University of East Anglia","Funda莽茫o para a Ci锚ncia e Tecnologia","12/1/2005","10.1016/j.envsci.2005.06.010","","","","","","","","","","","","0","0","11","0","0","0","0","0","1","0","0","0","0","0","0","0","0","848","358","https://www.altmetric.com/details/5332906","https://api.altmetric.com/v1/donut/5332906_240.png","Elsevier BV"
"12","Downscaling drivers of global environmental change: Enabling use of global SRES scenarios at the national and grid levels","Global Environmental Change Part A: Human & Policy Dimensions","0959-3780","","","Article","1","green","08 Information and Computing Sciences; 0806 Information Systems; 41 Environmental Sciences; 4104 Environmental Management","13 Climate Action","Netherlands Environmental Assessment Agency","","2/1/2007","10.1016/j.gloenvcha.2006.04.004","","","","","","","","","","","","0","0","11","0","0","0","0","0","0","0","0","0","0","0","0","0","0","262","174","https://www.altmetric.com/details/15363073","https://api.altmetric.com/v1/donut/15363073_240.png","Elsevier BV"
"26","Adaptation and mitigation: trade-offs in substance and methods","Environmental Science & Policy","1462-9011, 1873-6416","","","Article","","closed","05 Environmental Sciences; 07 Agricultural and Veterinary Sciences; 16 Studies in Human Society; 41 Environmental Sciences; 4101 Climate Change Impacts and Adaptation","13 Climate Action","Carnegie Mellon University; Universit盲t Hamburg; Vrije Universiteit Amsterdam","Directorate for Social, Behavioral & Economic Sciences; European Commission","12/1/2005","10.1016/j.envsci.2005.06.011","","","http://linkinghub.elsevier.com/retrieve/pii/S1462901105001061","","","","","","","","","0","0","10","0","3","0","0","0","0","0","0","0","0","0","0","0","0","382","193","https://www.altmetric.com/details/7619715","https://api.altmetric.com/v1/donut/7619715_240.png","Elsevier BV"
"19","From the Earth Summit to Rio+20: integration of health and sustainable development","The Lancet","0099-5355, 0140-6736, 1474-547X","","","Article","","closed","11 Medical and Health Sciences; 42 Health Sciences; 4206 Public Health","","Graduate Institute of International and Development Studies; London School of Hygiene & Tropical Medicine; World Health Organization; World Health Organization Regional Office for the Americas","World Health Organization","6/1/2012","10.1016/s0140-6736(12)60779-x","","","","22682465","","","","","","","","0","0","10","0","19","0","0","2","0","0","0","0","0","0","0","0","0","232","52","https://www.altmetric.com/details/782673","https://api.altmetric.com/v1/donut/782673_240.png","Elsevier BV; StatRef"
"5","Assessing the environmental impact of palm oil produced in Thailand","Journal of Cleaner Production","0959-6526, 1879-1786","","","Article","","closed","09 Engineering; 0907 Environmental Engineering; 0910 Manufacturing Engineering; 0915 Interdisciplinary Engineering; 33 Built Environment and Design; 40 Engineering","12 Responsible Consumption and Production; 13 Climate Action","Open University in the Netherlands; Wageningen University & Research; Walailak University","","8/1/2015","10.1016/j.jclepro.2015.03.037","","","","","","","","","","","","0","0","10","0","2","0","0","0","0","0","0","0","0","0","0","1","0","311","58","https://www.altmetric.com/details/46688236","https://api.altmetric.com/v1/donut/46688236_240.png","Elsevier BV"
"145","Climate change and marine fisheries: Least developed countries top global index of vulnerability","PLOS ONE","1932-6203","","","Article","1","gold","05 Environmental Sciences; 0502 Environmental Science and Management; 41 Environmental Sciences; 4101 Climate Change Impacts and Adaptation; 4104 Environmental Management; 48 Law and Legal Studies; 4803 International and Comparative Law","13 Climate Action","ARC Centre of Excellence for Coral Reef Studies; Stockholm University; United Nations University Institute for the Advanced Study of Sustainability; University of Tokyo; University of Waterloo","Japan Society for the Promotion of Science, Tokyo, Japan; Swedish International Development Cooperation Agency","6/20/2017","10.1371/journal.pone.0179632","","","","28632781","","","2017PLoSO..1279632B","","","","","8","2","9","0","99","0","0","2","0","0","0","0","0","0","0","0","0","401","116","https://www.altmetric.com/details/21204223","https://api.altmetric.com/v1/donut/21204223_240.png","Public Library of Science (PLOS)"
"129","Resource extraction and infrastructure threaten forest cover and community rights","Proceedings of the National Academy of Sciences of the United States of America","0027-8424, 1091-6490","","","Article","1","hybrid","05 Environmental Sciences; 0502 Environmental Science and Management; 41 Environmental Sciences; 4104 Environmental Management; 44 Human Society","15 Life on Land; 16 Peace, Justice and Strong Institutions","Clark University; Federal University of Rio de Janeiro; The Samdhana Institute; University of Manchester; University of Melbourne","Australian Research Council; Ford Foundation","12/3/2018","10.1073/pnas.1812505115","","","","30509982","","","","","","","","11","2","9","0","63","0","0","1","3","0","0","1","0","0","0","0","0","309","110","https://www.altmetric.com/details/52152390","https://api.altmetric.com/v1/donut/52152390_240.png","Proceedings of the National Academy of Sciences (PNAS)"
